<?xml version="1.0" encoding="UTF-8"?>
<impresoras xmlns:xsi="http://www.w3.org/2001/XMLSchema-instance" xsi:noNamespaceSchemaLocation="../../Sanz_Pans_Antonio_impresoras.xsd">
  <impresora numSerie="i245" tipo="3D" compra="2010">
    <marca>Epson</marca>
    <modelo>EPL300</modelo>
    <peso>4.52</peso>
    <tamaño>A4</tamaño>
    <tamaño>A5</tamaño>
    <cartucho>C-12AB</cartucho>
    <enred/>
  </impresora>
  
   <impresora numSerie="i245" tipo="3D" compra="2010">
    <marca>Cannon</marca>
    <modelo>Premium</modelo>
    <peso>2</peso>
    <tamaño>A4</tamaño>
    <cartucho>C-12AB</cartucho>
    <enred/>
  </impresora>
</impresoras>